-- Test the optimizer_enable_dml_constraints GUC, which forces GPORCA to fall back when there
-- are NULL or CHECK constraints on a table.
set optimizer_trace_fallback = on;
DROP TABLE IF EXISTS constr_tab;
NOTICE:  table "constr_tab" does not exist, skipping
CREATE TABLE constr_tab ( a int check (a>0) , b int, c int, d int, CHECK (a+b>5)) DISTRIBUTED BY (a);
set optimizer_enable_dml_constraints = off;
explain insert into constr_tab values (1,2,3);
                   QUERY PLAN                   
------------------------------------------------
 Insert on constr_tab  (cost=0.00..0.01 rows=1 width=0)
   ->  Result  (cost=0.00..0.01 rows=1 width=0)
 Optimizer status: Postgres query optimizer
(3 rows)

set optimizer_enable_dml_constraints=on;
explain insert into constr_tab values (1,2,3);
                   QUERY PLAN                   
------------------------------------------------
 Insert on constr_tab  (cost=0.00..0.01 rows=1 width=0)
   ->  Result  (cost=0.00..0.01 rows=1 width=0)
 Optimizer status: Postgres query optimizer
(3 rows)

-- The remaining tests require a row in the table.
INSERT INTO constr_tab VALUES(1,5,3,4);
set optimizer_enable_dml_constraints=off;
explain update constr_tab set a = 10;
                                       QUERY PLAN                                        
-----------------------------------------------------------------------------------------
 Update on constr_tab  (cost=0.00..1.01 rows=1 width=22)
   ->  Redistribute Motion 3:3  (slice1; segments: 3)  (cost=0.00..1.01 rows=1 width=22)
         Hash Key: a
         ->  Split  (cost=0.00..1.01 rows=1 width=22)
               ->  Seq Scan on constr_tab  (cost=0.00..1.01 rows=1 width=22)
 Optimizer: Postgres query optimizer
(6 rows)

explain update constr_tab set b = 10;
                           QUERY PLAN                            
-----------------------------------------------------------------
 Update on constr_tab  (cost=0.00..1.01 rows=1 width=22)
   ->  Seq Scan on constr_tab  (cost=0.00..1.01 rows=1 width=22)
 Optimizer status: Postgres query optimizer
(3 rows)

set optimizer_enable_dml_constraints=on;
explain update constr_tab set b = 10;
                           QUERY PLAN                            
-----------------------------------------------------------------
 Update on constr_tab  (cost=0.00..1.01 rows=1 width=22)
   ->  Seq Scan on constr_tab  (cost=0.00..1.01 rows=1 width=22)
 Optimizer status: Postgres query optimizer
(3 rows)

-- Same, with NOT NULL constraint.
DROP TABLE IF EXISTS constr_tab;
CREATE TABLE constr_tab ( a int NOT NULL, b int, c int, d int, CHECK (a+b>5)) DISTRIBUTED BY (a);
INSERT INTO constr_tab VALUES(1,5,3,4);
set optimizer_enable_dml_constraints=off;
explain update constr_tab set a = 10;
                                       QUERY PLAN                                        
-----------------------------------------------------------------------------------------
 Update on constr_tab  (cost=0.00..1.01 rows=1 width=22)
   ->  Redistribute Motion 3:3  (slice1; segments: 3)  (cost=0.00..1.01 rows=1 width=22)
         Hash Key: a
         ->  Split  (cost=0.00..1.01 rows=1 width=22)
               ->  Seq Scan on constr_tab  (cost=0.00..1.01 rows=1 width=22)
 Optimizer: Postgres query optimizer
(6 rows)

DROP TABLE IF EXISTS constr_tab;
CREATE TABLE constr_tab ( a int NOT NULL, b int NOT NULL, c int NOT NULL, d int NOT NULL) DISTRIBUTED BY (a,b);
INSERT INTO constr_tab VALUES(1,5,3,4);
INSERT INTO constr_tab VALUES(1,5,3,4);
set optimizer_enable_dml_constraints=off;
explain update constr_tab set b = 10;
                                       QUERY PLAN                                        
-----------------------------------------------------------------------------------------
 Update on constr_tab  (cost=0.00..1.01 rows=1 width=22)
   ->  Redistribute Motion 3:3  (slice1; segments: 3)  (cost=0.00..1.01 rows=1 width=22)
         Hash Key: a, b
         ->  Split  (cost=0.00..1.01 rows=1 width=22)
               ->  Seq Scan on constr_tab  (cost=0.00..1.01 rows=1 width=22)
 Optimizer: Postgres query optimizer
(6 rows)

DROP TABLE IF EXISTS constr_tab;
CREATE TABLE constr_tab ( a int, b int, c int, d int) DISTRIBUTED BY (a);
INSERT INTO constr_tab VALUES(1,5,3,4);
INSERT INTO constr_tab VALUES(1,5,3,4);
set optimizer_enable_dml_constraints=off;
explain update constr_tab set a = 10;
                                       QUERY PLAN                                        
-----------------------------------------------------------------------------------------
 Update on constr_tab  (cost=0.00..1.01 rows=1 width=22)
   ->  Redistribute Motion 3:3  (slice1; segments: 3)  (cost=0.00..1.01 rows=1 width=22)
         Hash Key: a
         ->  Split  (cost=0.00..1.01 rows=1 width=22)
               ->  Seq Scan on constr_tab  (cost=0.00..1.01 rows=1 width=22)
 Optimizer: Postgres query optimizer
(6 rows)

-- Test ORCA fallback on "FROM ONLY"
CREATE TABLE homer (a int, b int, c int)
DISTRIBUTED BY (a)
PARTITION BY range(b)
    SUBPARTITION BY range(c)
        SUBPARTITION TEMPLATE (
            START(40) END(46) EVERY(3)
        )
(START(0) END(4) EVERY(2));
NOTICE:  CREATE TABLE will create partition "homer_1_prt_1" for table "homer"
NOTICE:  CREATE TABLE will create partition "homer_1_prt_1_2_prt_1" for table "homer_1_prt_1"
NOTICE:  CREATE TABLE will create partition "homer_1_prt_1_2_prt_2" for table "homer_1_prt_1"
NOTICE:  CREATE TABLE will create partition "homer_1_prt_2" for table "homer"
NOTICE:  CREATE TABLE will create partition "homer_1_prt_2_2_prt_1" for table "homer_1_prt_2"
NOTICE:  CREATE TABLE will create partition "homer_1_prt_2_2_prt_2" for table "homer_1_prt_2"
INSERT INTO homer VALUES (1,0,40),(2,1,43),(3,2,41),(4,3,44);
SELECT * FROM ONLY homer;
 a | b | c 
---+---+---
(0 rows)

SELECT * FROM ONLY homer_1_prt_1;
 a | b | c 
---+---+---
(0 rows)

UPDATE ONLY homer SET c = c + 1;
SELECT * FROM homer;
 a | b | c  
---+---+----
 1 | 0 | 40
 2 | 1 | 43
 3 | 2 | 41
 4 | 3 | 44
(4 rows)

DELETE FROM ONLY homer WHERE a = 3;
SELECT * FROM homer;
 a | b | c  
---+---+----
 1 | 0 | 40
 2 | 1 | 43
 3 | 2 | 41
 4 | 3 | 44
(4 rows)

-- ORCA should not fallback just because external tables are in FROM clause
-- start_ignore
CREATE TABLE heap_t1 (a int, b int) DISTRIBUTED BY (b);
CREATE EXTERNAL TABLE ext_table_no_fallback (a int, b int) LOCATION ('gpfdist://myhost:8080/test.csv') FORMAT 'CSV';
-- end_ignore
EXPLAIN SELECT * FROM ext_table_no_fallback;
                                       QUERY PLAN                                        
-----------------------------------------------------------------------------------------
 Gather Motion 3:1  (slice1; segments: 3)  (cost=0.00..11000.00 rows=1000000 width=8)
   ->  External Scan on ext_table_no_fallback  (cost=0.00..11000.00 rows=333334 width=8)
 Optimizer: Postgres query optimizer
(3 rows)

EXPLAIN SELECT * FROM ONLY ext_table_no_fallback;
                                       QUERY PLAN                                        
-----------------------------------------------------------------------------------------
 Gather Motion 3:1  (slice1; segments: 3)  (cost=0.00..11000.00 rows=1000000 width=8)
   ->  External Scan on ext_table_no_fallback  (cost=0.00..11000.00 rows=333334 width=8)
 Optimizer: Postgres query optimizer
(3 rows)

EXPLAIN INSERT INTO heap_t1 SELECT * FROM ONLY ext_table_no_fallback;
                                           QUERY PLAN                                            
-------------------------------------------------------------------------------------------------
 Insert on heap_t1  (cost=0.00..11000.00 rows=333334 width=8)
   ->  Redistribute Motion 3:3  (slice1; segments: 3)  (cost=0.00..11000.00 rows=333334 width=8)
         Hash Key: ext_table_no_fallback.b
         ->  External Scan on ext_table_no_fallback  (cost=0.00..11000.00 rows=333334 width=8)
 Optimizer: Postgres query optimizer
(5 rows)

set optimizer_enable_dml=off;
EXPLAIN INSERT INTO homer VALUES (1,0,40),(2,1,43),(3,2,41),(4,3,44);
                                       QUERY PLAN                                        
-----------------------------------------------------------------------------------------
 Insert on homer  (cost=0.00..0.05 rows=2 width=12)
   ->  Redistribute Motion 1:3  (slice1; segments: 1)  (cost=0.00..0.05 rows=4 width=12)
         Hash Key: "*VALUES*".column1
         ->  Values Scan on "*VALUES*"  (cost=0.00..0.05 rows=2 width=12)
 Optimizer: Postgres query optimizer
(5 rows)

EXPLAIN UPDATE ONLY homer SET c = c + 1;
                            QUERY PLAN                             
-------------------------------------------------------------------
 Update on homer  (cost=0.00..1073.75 rows=25967 width=22)
   ->  Seq Scan on homer  (cost=0.00..1073.75 rows=25967 width=22)
 Optimizer: Postgres query optimizer
(3 rows)

EXPLAIN DELETE FROM ONLY homer WHERE a = 3;
                           QUERY PLAN                           
----------------------------------------------------------------
 Delete on homer  (cost=0.00..1073.75 rows=78 width=10)
   ->  Seq Scan on homer  (cost=0.00..1073.75 rows=26 width=10)
         Filter: (a = 3)
 Optimizer: Postgres query optimizer
(4 rows)

set optimizer_enable_dml=on;
create table foo(a int, b int);
NOTICE:  Table doesn't have 'DISTRIBUTED BY' clause -- Using column named 'a' as the Greenplum Database data distribution key for this table.
HINT:  The 'DISTRIBUTED BY' clause determines the distribution of data. Make sure column(s) chosen are the optimal data distribution key to minimize skew.
insert into foo select i%100, i%100 from generate_series(1,10000)i;
set optimizer_enable_hashagg = on;
set optimizer_enable_groupagg = on;
explain select count(*) from foo group by a;
                                    QUERY PLAN                                     
-----------------------------------------------------------------------------------
 Gather Motion 3:1  (slice1; segments: 3)  (cost=163.00..164.00 rows=100 width=12)
   ->  HashAggregate  (cost=163.00..164.00 rows=34 width=12)
         Group Key: a
         ->  Seq Scan on foo  (cost=0.00..113.00 rows=3334 width=4)
 Optimizer: Postgres query optimizer
(5 rows)

set optimizer_enable_hashagg = off;
set optimizer_enable_groupagg = on;
explain select count(*) from foo group by a;
                                    QUERY PLAN                                     
-----------------------------------------------------------------------------------
 Gather Motion 3:1  (slice1; segments: 3)  (cost=163.00..164.00 rows=100 width=12)
   ->  HashAggregate  (cost=163.00..164.00 rows=34 width=12)
         Group Key: a
         ->  Seq Scan on foo  (cost=0.00..113.00 rows=3334 width=4)
 Optimizer: Postgres query optimizer
(5 rows)

set optimizer_enable_hashagg = off;
set optimizer_enable_groupagg = off;
explain select count(*) from foo group by a;
                                    QUERY PLAN                                     
-----------------------------------------------------------------------------------
 Gather Motion 3:1  (slice1; segments: 3)  (cost=163.00..164.00 rows=100 width=12)
   ->  HashAggregate  (cost=163.00..164.00 rows=34 width=12)
         Group Key: a
         ->  Seq Scan on foo  (cost=0.00..113.00 rows=3334 width=4)
 Optimizer: Postgres query optimizer
(5 rows)

-- Test DROP TYPE..CASCADE on a user type associated with partition key doesn't drop
-- the column and error's out instead
CREATE TYPE bug_status AS ENUM ('new', 'open', 'closed');
CREATE TABLE partition_key_dropped(a int, b bug_status) PARTITION BY LIST(b)
( PARTITION p1 VALUES ('new'),
  PARTITION p2 VALUES ('open'));
NOTICE:  Table doesn't have 'DISTRIBUTED BY' clause -- Using column named 'a' as the Greenplum Database data distribution key for this table.
HINT:  The 'DISTRIBUTED BY' clause determines the distribution of data. Make sure column(s) chosen are the optimal data distribution key to minimize skew.
NOTICE:  CREATE TABLE will create partition "partition_key_dropped_1_prt_p1" for table "partition_key_dropped"
NOTICE:  CREATE TABLE will create partition "partition_key_dropped_1_prt_p2" for table "partition_key_dropped"
INSERT INTO partition_key_dropped VALUES(1, 'new');
INSERT INTO partition_key_dropped VALUES(2, 'open');
DROP TYPE bug_status CASCADE;
NOTICE:  drop cascades to 3 other objects
DETAIL:  drop cascades to table partition_key_dropped column b
drop cascades to table partition_key_dropped_1_prt_p1 column b
drop cascades to table partition_key_dropped_1_prt_p2 column b
ERROR:  cannot drop partitioning column "b" for table "partition_key_dropped"
EXPLAIN SELECT * FROM partition_key_dropped;
                                           QUERY PLAN                                           
------------------------------------------------------------------------------------------------
 Gather Motion 3:1  (slice1; segments: 3)  (cost=0.00..1922.00 rows=172200 width=8)
   ->  Append  (cost=0.00..1922.00 rows=57400 width=8)
         ->  Seq Scan on partition_key_dropped_1_prt_p1  (cost=0.00..961.00 rows=28700 width=8)
         ->  Seq Scan on partition_key_dropped_1_prt_p2  (cost=0.00..961.00 rows=28700 width=8)
 Optimizer: Postgres query optimizer
(5 rows)

SELECT * FROM partition_key_dropped;
 a |  b   
---+------
 2 | open
 1 | new
(2 rows)

EXPLAIN DELETE FROM partition_key_dropped WHERE a=1;
                                       QUERY PLAN                                        
-----------------------------------------------------------------------------------------
 Delete on partition_key_dropped_1_prt_p1  (cost=0.00..2352.50 rows=173 width=10)
   ->  Seq Scan on partition_key_dropped_1_prt_p1  (cost=0.00..1176.25 rows=29 width=10)
         Filter: (a = 1)
   ->  Seq Scan on partition_key_dropped_1_prt_p2  (cost=0.00..1176.25 rows=29 width=10)
         Filter: (a = 1)
 Optimizer: Postgres query optimizer
(6 rows)

DELETE FROM partition_key_dropped WHERE a=1;
EXPLAIN UPDATE partition_key_dropped SET a=21 where a=2;
                                             QUERY PLAN                                              
-----------------------------------------------------------------------------------------------------
 Update on partition_key_dropped_1_prt_p1  (cost=0.00..2355.94 rows=115 width=18)
   ->  Redistribute Motion 3:3  (slice1; segments: 3)  (cost=0.00..1177.97 rows=58 width=18)
         Hash Key: "outer".a
         ->  Split  (cost=0.00..1177.97 rows=58 width=18)
               ->  Seq Scan on partition_key_dropped_1_prt_p1  (cost=0.00..1176.25 rows=29 width=18)
                     Filter: (a = 2)
   ->  Redistribute Motion 3:3  (slice2; segments: 3)  (cost=0.00..1177.97 rows=58 width=18)
         Hash Key: "outer".a
         ->  Split  (cost=0.00..1177.97 rows=58 width=18)
               ->  Seq Scan on partition_key_dropped_1_prt_p2  (cost=0.00..1176.25 rows=29 width=18)
                     Filter: (a = 2)
 Optimizer: Postgres query optimizer
(12 rows)

UPDATE partition_key_dropped SET a=21 where a=2;
EXPLAIN INSERT INTO partition_key_dropped VALUES(3);
                            QUERY PLAN                             
-------------------------------------------------------------------
 Insert on partition_key_dropped  (cost=0.00..0.01 rows=1 width=0)
   ->  Result  (cost=0.00..0.01 rows=1 width=0)
 Optimizer: Postgres query optimizer
(3 rows)

INSERT INTO partition_key_dropped VALUES(3);
ERROR:  no partition for partitioning key  (seg0 127.0.0.1:6002 pid=13466)
-- Orca should fallback if a function in 'from' clause uses 'WITH ORDINALITY'
SELECT * FROM jsonb_array_elements('["b", "a"]'::jsonb) WITH ORDINALITY;
 value | ordinality 
-------+------------
 "b"   |          1
 "a"   |          2
(2 rows)

